{"family_id":"university-admissions","fixture_id":"pc-sealed-02","schema_version":1,"split":"sealed","task":{"after_html":"<portal><h1>Graduate admission</h1><p data-region-id=\"region-80539a1074\">Application deadline: 15 September</p><p data-region-id=\"region-bc0f0dbb39\">Portfolio interview: required</p><progress data-region-id=\"region-9e0b738570\">719 applications submitted</progress><data data-region-id=\"region-63d4d9ad16\">catalog sync 02:38 UTC</data><code data-region-id=\"region-3b34603a90\">publication bundle pb-62</code><section data-region-id=\"region-40b342d629\"><article>Online</article><article>North campus</article><article>City campus</article></section></portal>","before_html":"<portal><h1>Graduate admission</h1><p data-region-id=\"region-80539a1074\">Application deadline: 1 October</p><p data-region-id=\"region-bc0f0dbb39\">Portfolio interview: optional</p><progress data-region-id=\"region-9e0b738570\">684 applications submitted</progress><data data-region-id=\"region-63d4d9ad16\">catalog sync 02:31 UTC</data><code data-region-id=\"region-3b34603a90\">publication bundle pb-61</code><section data-region-id=\"region-40b342d629\"><article>North campus</article><article>City campus</article><article>Online</article></section></portal>","region_ids":["region-80539a1074","region-bc0f0dbb39","region-9e0b738570","region-63d4d9ad16","region-3b34603a90","region-40b342d629"]},"task_id":"page-2cf6e1d7aed4"}
