{"family_id":"api-reference","fixture_id":"pc-development-03","schema_version":1,"split":"development","task":{"after_html":"<div class=\"docs-grid\"><nav>Cinder API</nav><pre data-region-id=\"region-ec2893604a\">Legacy endpoint retires 15 October.</pre><div data-region-id=\"region-1355f4fb15\">8,437 repository stars</div><code data-region-id=\"region-07fdd42518\">docs build b07d9e</code><p data-region-id=\"region-8ff7977564\">Authentication uses bearer tokens.</p></div>","before_html":"<div class=\"docs-grid\"><nav>Cinder API</nav><pre data-region-id=\"region-ec2893604a\">Legacy endpoint retires 30 November.</pre><div data-region-id=\"region-1355f4fb15\">8,412 repository stars</div><code data-region-id=\"region-07fdd42518\">docs build a81f2c</code><p data-region-id=\"region-8ff7977564\">Authentication uses bearer tokens.</p></div>","region_ids":["region-ec2893604a","region-1355f4fb15","region-07fdd42518","region-8ff7977564"]},"task_id":"page-0d585d7b8d15"}
