{"family_id":"grocery-delivery-tracker","fixture_id":"pc-regression-04","schema_version":1,"split":"regression","task":{"after_html":"<main class=\"delivery-shell\"><h1>Order #4821</h1><section data-region-id=\"region-9fb7a9904e\">Total: $9.99</section><aside data-region-id=\"region-187568686e\">Arrives in 18 min</aside><footer data-region-id=\"region-2db0ce59aa\">Cache-Key: 91b47e</footer></main>","before_html":"<main class=\"delivery-shell\"><h1>Order #4821</h1><section data-region-id=\"region-9fb7a9904e\">Total: $12.99</section><aside data-region-id=\"region-187568686e\">Arrives in 25 min</aside><footer data-region-id=\"region-2db0ce59aa\">Cache-Key: 3f2a9c</footer></main>","region_ids":["region-9fb7a9904e","region-187568686e","region-2db0ce59aa"]},"task_id":"page-7476af1c04da"}
