{"family_id":"rail-timetable","fixture_id":"pc-regression-02","schema_version":1,"split":"regression","task":{"after_html":"<table><caption>East line</caption><tbody><tr data-region-id=\"region-b8c7219c8f\"><th>Departure</th><td>08:25</td></tr><tr data-region-id=\"region-16a3aaaa69\"><th>Watching</th><td>158 riders</td></tr><tr data-region-id=\"region-e9367212d3\"><th>Timetable build</th><td>tt-903</td></tr></tbody></table><nav data-region-id=\"region-dc3b0db0d3\"><a>Airport</a><a>Central</a><a>Riverside</a></nav>","before_html":"<table><caption>East line</caption><tbody><tr data-region-id=\"region-b8c7219c8f\"><th>Departure</th><td>08:10</td></tr><tr data-region-id=\"region-16a3aaaa69\"><th>Watching</th><td>144 riders</td></tr><tr data-region-id=\"region-e9367212d3\"><th>Timetable build</th><td>tt-902</td></tr></tbody></table><nav data-region-id=\"region-dc3b0db0d3\"><a>Central</a><a>Riverside</a><a>Airport</a></nav>","region_ids":["region-b8c7219c8f","region-16a3aaaa69","region-e9367212d3","region-dc3b0db0d3"]},"task_id":"page-4b7129afc57b"}
