{"family_id":"subscription-pricing","fixture_id":"pc-development-01","schema_version":1,"split":"development","task":{"after_html":"<main class=\"pricing-shell\"><h1>OrbitDesk Plans</h1><section data-region-id=\"region-28ebc79be0\"><span>$24 monthly</span></section><aside data-region-id=\"region-7804198a80\">1,259 teams online</aside><footer data-region-id=\"region-c40e189407\">Rendered at 2026-08-20T10:22Z</footer><p data-region-id=\"region-93fda3bcc5\">Cancel anytime.</p></main>","before_html":"<main class=\"pricing-shell\"><h1>OrbitDesk Plans</h1><section data-region-id=\"region-28ebc79be0\"><span>$19 monthly</span></section><aside data-region-id=\"region-7804198a80\">1,204 teams online</aside><footer data-region-id=\"region-c40e189407\">Rendered at 2026-08-20T10:15Z</footer><p data-region-id=\"region-93fda3bcc5\">Cancel anytime.</p></main>","region_ids":["region-28ebc79be0","region-7804198a80","region-c40e189407","region-93fda3bcc5"]},"task_id":"page-e2dd77b9b77b"}
