{"family_id":"service-status","fixture_id":"pc-development-06","schema_version":1,"split":"development","task":{"after_html":"<dashboard><h1>Beacon Status</h1><output data-region-id=\"region-ed96c67020\">329 checks in the last minute</output><samp data-region-id=\"region-ee24cf8419\">deployment marker west-772</samp><menu data-region-id=\"region-f589f2c58d\"><li>Asia</li><li>Europe</li><li>Americas</li></menu><strong data-region-id=\"region-9ad131d96d\">All systems operational</strong></dashboard>","before_html":"<dashboard><h1>Beacon Status</h1><output data-region-id=\"region-ed96c67020\">312 checks in the last minute</output><samp data-region-id=\"region-ee24cf8419\">deployment marker west-771</samp><menu data-region-id=\"region-f589f2c58d\"><li>Europe</li><li>Americas</li><li>Asia</li></menu><strong data-region-id=\"region-9ad131d96d\">All systems operational</strong></dashboard>","region_ids":["region-ed96c67020","region-ee24cf8419","region-f589f2c58d","region-9ad131d96d"]},"task_id":"page-68bc910c95b6"}
