{"family_id":"flight-status-board","fixture_id":"pc-regression-06","schema_version":1,"split":"regression","task":{"after_html":"<main class=\"flight-shell\"><h1>Flight OD214</h1><section data-region-id=\"region-44d8060263\">Gate: B19</section><aside data-region-id=\"region-2451168d91\">Boarding in 33</aside><footer data-region-id=\"region-7946f74ea0\">Refreshed at 2026-08-24T06:27Z</footer></main>","before_html":"<main class=\"flight-shell\"><h1>Flight OD214</h1><section data-region-id=\"region-44d8060263\">Gate: B12</section><aside data-region-id=\"region-2451168d91\">Boarding in 40</aside><footer data-region-id=\"region-7946f74ea0\">Refreshed at 2026-08-24T06:12Z</footer></main>","region_ids":["region-44d8060263","region-2451168d91","region-7946f74ea0"]},"task_id":"page-ef87ffd2f4f3"}
