{"family_id":"utility-plan","fixture_id":"pc-sealed-01","schema_version":1,"split":"sealed","task":{"after_html":"<main><h1>Home energy plan</h1><section data-region-id=\"region-c9b736068d\">Energy price $0.17 per kWh</section><section data-region-id=\"region-30a27e76ce\">Minimum term 24 months</section><output data-region-id=\"region-243e141483\">28 households viewing</output><aside data-region-id=\"region-69baf63c5f\">Tip of the hour: lower water heat</aside><small data-region-id=\"region-ec1c659bc0\">forecast snapshot en-119</small><ul data-region-id=\"region-fc611942c2\"><li>Support</li><li>Usage</li><li>Rates</li></ul></main>","before_html":"<main><h1>Home energy plan</h1><section data-region-id=\"region-c9b736068d\">Energy price $0.14 per kWh</section><section data-region-id=\"region-30a27e76ce\">Minimum term 12 months</section><output data-region-id=\"region-243e141483\">21 households viewing</output><aside data-region-id=\"region-69baf63c5f\">Tip of the hour: seal window gaps</aside><small data-region-id=\"region-ec1c659bc0\">forecast snapshot en-118</small><ul data-region-id=\"region-fc611942c2\"><li>Usage</li><li>Rates</li><li>Support</li></ul></main>","region_ids":["region-c9b736068d","region-30a27e76ce","region-243e141483","region-69baf63c5f","region-ec1c659bc0","region-fc611942c2"]},"task_id":"page-cd951485706d"}
