{"family_id":"canary-synthetic","fixture_id":"pc-development-00","schema_version":1,"split":"development","task":{"after_html":"<main><p data-region-id=\"region-d94329861d\">Build 101</p></main>","before_html":"<main><p data-region-id=\"region-d94329861d\">Build 100</p></main>","region_ids":["region-d94329861d"]},"task_id":"page-7af01fe15924"}
